{
  "$schema": "../../schemas/pay-tax.schema.json",
  "version": "1.0.0",
  "generatedAt": "2026-08-28",
  "financialYear": "2026-27",
  "taxYear": "2026-27",
  "disclaimer": {
    "en": "Reference only; verify with the official gazette/order or your DDO.",
    "hi": "केवल संदर्भ हेतु; आधिकारिक राजपत्र/आदेश अथवा अपने डीडीओ से पुष्टि करें।"
  },
  "note": {
    "en": "The Income-tax Act, 2025 commences on 1 April 2026 and governs the 2026-27 tax year, replacing the Income-tax Act, 1961. It renumbers the provisions without, for salary income, changing what they do: section 80C becomes section 123 and section 80CCD becomes section 124. Both numbers are given for every provision here, and the 2025 numbers carry verify because they were not read from the Act itself.",
    "hi": "आयकर अधिनियम, 2025 1 अप्रैल 2026 से प्रवृत्त होता है और कर वर्ष 2026-27 को शासित करता है, जो आयकर अधिनियम, 1961 का स्थान लेता है। यह प्रावधानों को पुनःक्रमांकित करता है, किंतु वेतन आय के संबंध में उनके प्रभाव को नहीं बदलता: धारा 80C धारा 123 बन जाती है और धारा 80CCD धारा 124। यहाँ प्रत्येक प्रावधान के लिए दोनों संख्याएँ दी गई हैं, और 2025 की संख्याएँ verify के साथ हैं क्योंकि वे स्वयं अधिनियम से नहीं पढ़ी गई हैं।"
  },
  "regimes": [
    {
      "id": "new",
      "name": {
        "en": "New regime (default)",
        "hi": "नई कर व्यवस्था (डिफ़ॉल्ट)"
      },
      "isDefault": true,
      "standardDeduction": 75000,
      "slabs": [
        {
          "from": 0,
          "to": 400000,
          "rate": 0
        },
        {
          "from": 400000,
          "to": 800000,
          "rate": 5
        },
        {
          "from": 800000,
          "to": 1200000,
          "rate": 10
        },
        {
          "from": 1200000,
          "to": 1600000,
          "rate": 15
        },
        {
          "from": 1600000,
          "to": 2000000,
          "rate": 20
        },
        {
          "from": 2000000,
          "to": 2400000,
          "rate": 25
        },
        {
          "from": 2400000,
          "to": null,
          "rate": 30
        }
      ],
      "rebate": {
        "section": "87A (Income-tax Act, 1961)",
        "incomeCeiling": 1200000,
        "maxRebate": 60000,
        "note": {
          "en": "A resident individual with total income up to ₹12,00,000 pays no tax. With the ₹75,000 standard deduction, that is a salary of ₹12,75,000. The rebate does not apply to income taxed at special rates.",
          "hi": "₹12,00,000 तक की कुल आय वाले निवासी व्यष्टि को कोई कर नहीं देना पड़ता। ₹75,000 की मानक कटौती के साथ यह ₹12,75,000 का वेतन बनता है। विशेष दरों पर कर योग्य आय पर यह छूट लागू नहीं होती।"
        }
      },
      "note": {
        "en": "The default regime. There are no age-based exemption limits: ₹4,00,000 is the threshold for everyone. Almost every deduction and exemption is unavailable here; the exceptions that matter to a salaried officer are the standard deduction, the employer's contribution to the National Pension System, and the transport allowance for a differently abled employee.",
        "hi": "यही डिफ़ॉल्ट व्यवस्था है। यहाँ आयु-आधारित छूट सीमाएँ नहीं हैं: ₹4,00,000 सभी के लिए सीमा है। लगभग हर कटौती एवं छूट यहाँ उपलब्ध नहीं है; वेतनभोगी अधिकारी के लिए महत्वपूर्ण अपवाद हैं — मानक कटौती, राष्ट्रीय पेंशन प्रणाली में नियोक्ता का अंशदान, तथा दिव्यांग कर्मचारी का परिवहन भत्ता।"
      },
      "source": {
        "name": "Income Tax Department, Government of India",
        "url": "https://www.incometax.gov.in/",
        "note": {
          "en": "incometax.gov.in redirects and serves no fetchable document to a plain request, so the figures here were not read from a departmental page or from the Finance Act itself. Budget 2026 made no change to the slabs introduced by the Finance Act, 2025, and they continue for the 2026-27 tax year. Confirm before filing.",
          "hi": "incometax.gov.in पुनर्निर्देशित होता है और सामान्य अनुरोध पर कोई प्राप्य दस्तावेज़ नहीं देता, अतः यहाँ दिए गए अंक न किसी विभागीय पृष्ठ से और न ही स्वयं वित्त अधिनियम से पढ़े गए हैं। बजट 2026 ने वित्त अधिनियम, 2025 द्वारा प्रस्तुत स्लैबों में कोई परिवर्तन नहीं किया, और वे कर वर्ष 2026-27 के लिए जारी हैं। दाख़िल करने से पूर्व पुष्टि करें।"
        }
      },
      "fetchedAt": "2026-08-28T00:00:00Z",
      "verify": true
    },
    {
      "id": "old",
      "name": {
        "en": "Old regime (optional)",
        "hi": "पुरानी कर व्यवस्था (वैकल्पिक)"
      },
      "isDefault": false,
      "standardDeduction": 50000,
      "slabs": [
        {
          "from": 0,
          "to": 250000,
          "rate": 0,
          "ageBand": "below-60"
        },
        {
          "from": 250000,
          "to": 500000,
          "rate": 5,
          "ageBand": "below-60"
        },
        {
          "from": 500000,
          "to": 1000000,
          "rate": 20,
          "ageBand": "below-60"
        },
        {
          "from": 1000000,
          "to": null,
          "rate": 30,
          "ageBand": "below-60"
        },
        {
          "from": 0,
          "to": 300000,
          "rate": 0,
          "ageBand": "60-to-80"
        },
        {
          "from": 300000,
          "to": 500000,
          "rate": 5,
          "ageBand": "60-to-80"
        },
        {
          "from": 500000,
          "to": 1000000,
          "rate": 20,
          "ageBand": "60-to-80"
        },
        {
          "from": 1000000,
          "to": null,
          "rate": 30,
          "ageBand": "60-to-80"
        },
        {
          "from": 0,
          "to": 500000,
          "rate": 0,
          "ageBand": "80-and-above"
        },
        {
          "from": 500000,
          "to": 1000000,
          "rate": 20,
          "ageBand": "80-and-above"
        },
        {
          "from": 1000000,
          "to": null,
          "rate": 30,
          "ageBand": "80-and-above"
        }
      ],
      "rebate": {
        "section": "87A (Income-tax Act, 1961)",
        "incomeCeiling": 500000,
        "maxRebate": 12500,
        "note": {
          "en": "A resident individual with total income up to ₹5,00,000 pays no tax.",
          "hi": "₹5,00,000 तक की कुल आय वाले निवासी व्यष्टि को कोई कर नहीं देना पड़ता।"
        }
      },
      "note": {
        "en": "Has to be opted into. Worth it only where the deductions and exemptions actually claimed — House Rent Allowance, section 80C, the home loan interest, section 80D — outweigh the higher rates and the smaller standard deduction. The exemption limit is ₹3,00,000 for a resident aged 60 to 80 and ₹5,00,000 for one aged 80 or above.",
        "hi": "इसे चुनना पड़ता है। यह तभी लाभप्रद है जब वास्तव में दावा की गई कटौतियाँ एवं छूटें — मकान किराया भत्ता, धारा 80C, गृह ऋण ब्याज, धारा 80D — ऊँची दरों तथा छोटी मानक कटौती पर भारी पड़ें। 60 से 80 वर्ष के निवासी के लिए छूट सीमा ₹3,00,000 तथा 80 वर्ष या उससे अधिक के लिए ₹5,00,000 है।"
      },
      "source": {
        "name": "Income Tax Department, Government of India",
        "url": "https://www.incometax.gov.in/",
        "note": {
          "en": "incometax.gov.in redirects and serves no fetchable document to a plain request, so the figures here were not read from a departmental page or from the Finance Act itself. Budget 2026 made no change to the slabs introduced by the Finance Act, 2025, and they continue for the 2026-27 tax year. Confirm before filing.",
          "hi": "incometax.gov.in पुनर्निर्देशित होता है और सामान्य अनुरोध पर कोई प्राप्य दस्तावेज़ नहीं देता, अतः यहाँ दिए गए अंक न किसी विभागीय पृष्ठ से और न ही स्वयं वित्त अधिनियम से पढ़े गए हैं। बजट 2026 ने वित्त अधिनियम, 2025 द्वारा प्रस्तुत स्लैबों में कोई परिवर्तन नहीं किया, और वे कर वर्ष 2026-27 के लिए जारी हैं। दाख़िल करने से पूर्व पुष्टि करें।"
        }
      },
      "fetchedAt": "2026-08-28T00:00:00Z",
      "verify": true
    }
  ],
  "deductions": [
    {
      "id": "80c",
      "name": {
        "en": "Life insurance premia, provident fund, specified savings",
        "hi": "जीवन बीमा प्रीमियम, भविष्य निधि, विनिर्दिष्ट बचत"
      },
      "section1961": "80C",
      "section2025": "123",
      "limit": 150000,
      "limitNote": null,
      "regimes": [
        "old"
      ],
      "description": {
        "en": "Covers General Provident Fund and Contributory Provident Fund subscriptions, the CGEGIS subscription, life insurance premia, tuition fees for up to two children, the principal on a housing loan, Public Provident Fund, National Savings Certificates, five-year tax-saving deposits and equity-linked savings schemes. The ceiling is shared with sections 80CCC and 80CCD(1).",
        "hi": "इसमें सामान्य भविष्य निधि तथा अंशदायी भविष्य निधि के अंशदान, सीजीईजीआईएस अंशदान, जीवन बीमा प्रीमियम, दो संतानों तक की शिक्षण फ़ीस, आवास ऋण का मूलधन, लोक भविष्य निधि, राष्ट्रीय बचत पत्र, पाँच वर्षीय कर-बचत जमा तथा इक्विटी-संबद्ध बचत योजनाएँ आती हैं। यह सीमा धारा 80CCC तथा 80CCD(1) के साथ साझा है।"
      },
      "source": {
        "name": "Income Tax Department, Government of India",
        "url": "https://www.incometax.gov.in/",
        "note": {
          "en": "incometax.gov.in redirects and serves no fetchable document to a plain request, so the figures here were not read from a departmental page or from the Finance Act itself. Budget 2026 made no change to the slabs introduced by the Finance Act, 2025, and they continue for the 2026-27 tax year. Confirm before filing.",
          "hi": "incometax.gov.in पुनर्निर्देशित होता है और सामान्य अनुरोध पर कोई प्राप्य दस्तावेज़ नहीं देता, अतः यहाँ दिए गए अंक न किसी विभागीय पृष्ठ से और न ही स्वयं वित्त अधिनियम से पढ़े गए हैं। बजट 2026 ने वित्त अधिनियम, 2025 द्वारा प्रस्तुत स्लैबों में कोई परिवर्तन नहीं किया, और वे कर वर्ष 2026-27 के लिए जारी हैं। दाख़िल करने से पूर्व पुष्टि करें।"
        }
      },
      "fetchedAt": "2026-08-28T00:00:00Z",
      "verify": true
    },
    {
      "id": "80ccd1",
      "name": {
        "en": "Employee's own contribution to the National Pension System",